{
  "schemaVersion": "v1alpha1",
  "generatedAt": "2026-01-01T00:00:00Z",
  "scanner": {
    "version": "dev",
    "resolverVersion": "resolver-v0-placeholder",
    "controlPacks": [
      {
        "name": "builtin-empty",
        "version": "0.0.0",
        "source": "builtin"
      }
    ]
  },
  "scan": {
    "clusterContext": "fixture",
    "scope": {
      "allNamespaces": true
    },
    "dataSources": {
      "kubernetesAPI": true,
      "prometheus": {
        "enabled": false
      }
    }
  },
  "permissionSummary": [],
  "inventory": {
    "counts": {},
    "dataPlane": {
      "mode": "unknown"
    },
    "multiCluster": {
      "participationDetected": false,
      "evaluated": false
    }
  },
  "workloadPostures": [],
  "findings": [],
  "scores": {
    "overall": null,
    "categories": []
  }
}
